[
  {
    "cooling_type": "closed_loop_liquid",
    "cooling_description": "Developer states DV4 will operate a closed-loop cooling system with water recirculating continuously; 'roughly the same amount of water as one average family home', no evaporative cooling and 'no ongoing water consumption for cooling'",
    "annual_water_m3": null,
    "potable_water": null,
    "closed_loop": true,
    "wue_l_per_kwh": 0.05,
    "estimate_type": "developer",
    "state": "developer_stated",
    "confidence": "medium",
    "notes": "DataVita's submission announcement repeats the closed-loop/no-evaporative-cooling design and states a WUE target of no more than 0.05 L/kWh. This is a design target, not measured use; annual and initial-fill volumes remain undisclosed.",
    "source_ids": ["src-datavita-aigz-faq", "src-aprs-chapelhall-aigz", "src-datavita-dv4-submission-2026"]
  }
]
